<xs:schema elementFormDefault="qualified" xmlns:xs="http://www.w3.org/2001/XMLSchema" xmlns:types="types">
    <xs:import namespace="types" schemaLocation="types.xsd"/>
    <xs:element name="userProfiles">
        <xs:complexType>
            <xs:sequence>
                <xs:element name="userProfile" maxOccurs="unbounded">
                    <xs:complexType>
                        <xs:sequence>
                            <xs:element type="types:uuid" name="uuid"/>
                            <xs:element name="infoSystems">
                                <xs:complexType>
                                    <xs:sequence>
                                        <xs:element name="infoSystem" maxOccurs="unbounded">
                                            <xs:complexType>
                                                <xs:sequence>
                                                    <xs:element type="xs:string" name="techName"/>
                                                    <xs:element name="rolesToAdd" minOccurs="0">
                                                        <xs:complexType>
                                                            <xs:sequence>
                                                                <xs:element name="role" minOccurs="0"
                                                                            maxOccurs="unbounded">
                                                                    <xs:complexType>
                                                                        <xs:sequence>
                                                                            <xs:element type="xs:string"
                                                                                        name="techName"/>
                                                                            <xs:element type="xs:dateTime"
                                                                                        name="startDate"/>
                                                                            <xs:element type="xs:dateTime"
                                                                                        name="endDate"
                                                                                        minOccurs="0"/>
                                                                            <xs:element name="controlledInfoSystemTechName"
                                                                                        minOccurs="0">
                                                                                <xs:simpleType>
                                                                                    <xs:restriction base="xs:string">
                                                                                        <xs:minLength value="1"/>
                                                                                    </xs:restriction>
                                                                                </xs:simpleType>
                                                                            </xs:element>
                                                                        </xs:sequence>
                                                                    </xs:complexType>
                                                                </xs:element>
                                                            </xs:sequence>
                                                        </xs:complexType>
                                                    </xs:element>
                                                    <xs:element name="rolesToDelete" minOccurs="0">
                                                        <xs:complexType>
                                                            <xs:sequence>
                                                                <xs:element name="role" minOccurs="0"
                                                                            maxOccurs="unbounded">
                                                                    <xs:complexType>
                                                                        <xs:sequence>
                                                                            <xs:element type="xs:string"
                                                                                        name="techName"/>
                                                                        </xs:sequence>
                                                                    </xs:complexType>
                                                                </xs:element>
                                                            </xs:sequence>
                                                        </xs:complexType>
                                                    </xs:element>
                                                </xs:sequence>
                                            </xs:complexType>
                                        </xs:element>
                                    </xs:sequence>
                                </xs:complexType>
                            </xs:element>
                        </xs:sequence>
                    </xs:complexType>
                </xs:element>
            </xs:sequence>
        </xs:complexType>
    </xs:element>
</xs:schema>